Titles,Dates,Sources
Thủ tướng Nhật Bản và phu nhân đến Việt Nam vào 18/10,"Thứ sáu, 16/10/2020, 17:03 (GMT+7)",https://vnexpress.net/thu-tuong-nhat-ban-va-phu-nhan-den-viet-nam-vao-18-10-4177725.html
Thủy thủ tàu sân bay Mỹ tự sát khi đứng gác,"Thứ sáu, 16/10/2020, 15:36 (GMT+7)",https://vnexpress.net/thuy-thu-tau-san-bay-my-tu-sat-khi-dung-gac-4177687.html
Hai người biểu tình Thái Lan bị bắt vì vây xe Hoàng hậu,"Thứ sáu, 16/10/2020, 15:27 (GMT+7)",https://vnexpress.net/hai-nguoi-bieu-tinh-thai-lan-bi-bat-vi-vay-xe-hoang-hau-4177644.html
Quan hệ của con trai Biden ở Trung Quốc gây nghi ngờ,"Thứ sáu, 16/10/2020, 15:20 (GMT+7)",https://vnexpress.net/quan-he-cua-con-trai-biden-o-trung-quoc-gay-nghi-ngo-4177375.html
Thủ tướng Thái Lan tuyên bố không từ chức,"Thứ sáu, 16/10/2020, 15:14 (GMT+7)",https://vnexpress.net/thu-tuong-thai-lan-tuyen-bo-khong-tu-chuc-4177642.html
FBI điều tra email nghi của con trai Biden,"Thứ sáu, 16/10/2020, 15:08 (GMT+7)",https://vnexpress.net/fbi-dieu-tra-email-nghi-cua-con-trai-biden-4177635.html
Trung Quốc tung vaccine Covid-19 thử nghiệm giá 60 USD,"Thứ sáu, 16/10/2020, 14:48 (GMT+7)",https://vnexpress.net/trung-quoc-tung-vaccine-covid-19-thu-nghiem-gia-60-usd-4177637.html
Tàu hải cảnh Trung Quốc áp sát đảo tranh chấp với Nhật lâu kỷ lục,"Thứ sáu, 16/10/2020, 14:37 (GMT+7)",https://vnexpress.net/tau-hai-canh-trung-quoc-ap-sat-dao-tranh-chap-voi-nhat-lau-ky-luc-4177629.html
4 vũ khí giúp Đức ứng phó Covid-19,"Thứ sáu, 16/10/2020, 14:00 (GMT+7)",https://vnexpress.net/4-vu-khi-giup-duc-ung-pho-covid-19-4176801.html
Hoàng tử Thái Lan nhấc bổng chị gái trong lễ tưởng niệm cố vương,"Thứ sáu, 16/10/2020, 12:29 (GMT+7)",https://vnexpress.net/hoang-tu-thai-lan-nhac-bong-chi-gai-trong-le-tuong-niem-co-vuong-4177559.html
Nhật sẽ xả triệu tấn nước xử lý từ Fukushima ra biển,"Thứ sáu, 16/10/2020, 12:11 (GMT+7)",https://vnexpress.net/nhat-se-xa-trieu-tan-nuoc-xu-ly-tu-fukushima-ra-bien-4177589.html
Chính quyền Trump từ chối yêu cầu hỗ trợ cháy rừng ở California,"Thứ sáu, 16/10/2020, 12:05 (GMT+7)",https://vnexpress.net/chinh-quyen-trump-tu-choi-yeu-cau-ho-tro-chay-rung-o-california-4177565.html
Ba năm bí mật điều tra dòng tiền tranh cử của Trump,"Thứ sáu, 16/10/2020, 12:00 (GMT+7)",https://vnexpress.net/ba-nam-bi-mat-dieu-tra-dong-tien-tranh-cu-cua-trump-4177124.html
Trump chế nhạo Fauci theo phe 'Dân chủ',"Thứ sáu, 16/10/2020, 11:59 (GMT+7)",https://vnexpress.net/trump-che-nhao-fauci-theo-phe-dan-chu-4177577.html
"Facebook, Twitter tự 'giẫm chân' khi chặn bài báo chỉ trích Biden","Thứ sáu, 16/10/2020, 11:27 (GMT+7)",https://vnexpress.net/facebook-twitter-tu-giam-chan-khi-chan-bai-bao-chi-trich-biden-4177439.html
Thủy thủ tàu ngầm Anh nhiễm nCoV vì tiệc tùng tại Mỹ,"Thứ sáu, 16/10/2020, 11:03 (GMT+7)",https://vnexpress.net/thuy-thu-tau-ngam-anh-nhiem-ncov-vi-tiec-tung-tai-my-4177509.html
Nghị sĩ giấu tiền biển thủ trong đồ lót,"Thứ sáu, 16/10/2020, 10:52 (GMT+7)",https://vnexpress.net/nghi-si-giau-tien-bien-thu-trong-do-lot-4177485.html
Ông Tập ho nhiều lần khi phát biểu,"Thứ sáu, 16/10/2020, 10:50 (GMT+7)",https://vnexpress.net/ong-tap-ho-nhieu-lan-khi-phat-bieu-4177447.html
Trump nói sẽ chấp nhận chuyển giao quyền lực hòa bình,"Thứ sáu, 16/10/2020, 10:38 (GMT+7)",https://vnexpress.net/trump-noi-se-chap-nhan-chuyen-giao-quyen-luc-hoa-binh-4177464.html
Mỹ bắt cựu bộ trưởng quốc phòng Mexico,"Thứ sáu, 16/10/2020, 10:22 (GMT+7)",https://vnexpress.net/my-bat-cuu-bo-truong-quoc-phong-mexico-4177474.html
Trump - Biden 'đấu khẩu' qua truyền hình trực tiếp,"Thứ sáu, 16/10/2020, 10:15 (GMT+7)",https://vnexpress.net/trump-biden-dau-khau-qua-truyen-hinh-truc-tiep-4177406.html
Người da màu giàu nhất nước Mỹ thừa nhận trốn thuế,"Thứ sáu, 16/10/2020, 09:25 (GMT+7)",https://vnexpress.net/nguoi-da-mau-giau-nhat-nuoc-my-thua-nhan-tron-thue-4177421.html
Trump 'không nhớ' đã xét nghiệm trước tranh luận với Biden,"Thứ sáu, 16/10/2020, 08:55 (GMT+7)",https://vnexpress.net/trump-khong-nho-da-xet-nghiem-truoc-tranh-luan-voi-biden-4177392.html
Trung Quốc có thể đang mở rộng nhà máy đóng tàu ngầm,"Thứ sáu, 16/10/2020, 08:45 (GMT+7)",https://vnexpress.net/trung-quoc-co-the-dang-mo-rong-nha-may-dong-tau-ngam-4177420.html
Nữ hoàng Anh bị chỉ trích vì không đeo khẩu trang,"Thứ sáu, 16/10/2020, 08:26 (GMT+7)",https://vnexpress.net/nu-hoang-anh-bi-chi-trich-vi-khong-deo-khau-trang-4177391.html
Hai mảng sáng tối kinh tế Mỹ trong nhiệm kỳ của Trump,"Thứ sáu, 16/10/2020, 08:00 (GMT+7)",https://vnexpress.net/hai-mang-sang-toi-kinh-te-my-trong-nhiem-ky-cua-trump-4176772.html
Hàng chục nghìn người Thái Lan biểu tình ở Bangkok,"Thứ sáu, 16/10/2020, 07:32 (GMT+7)",https://vnexpress.net/hang-chuc-nghin-nguoi-thai-lan-bieu-tinh-o-bangkok-4177372.html
Biden đi máy bay cùng nhân viên dương tính nCoV,"Thứ sáu, 16/10/2020, 07:04 (GMT+7)",https://vnexpress.net/biden-di-may-bay-cung-nhan-vien-duong-tinh-ncov-4177368.html
Hơn 39 triệu người đã nhiễm nCoV toàn cầu,"Thứ sáu, 16/10/2020, 06:45 (GMT+7)",https://vnexpress.net/hon-39-trieu-nguoi-da-nhiem-ncov-toan-cau-4177365.html
Nhóm tàu sân bay Mỹ tiến vào Biển Đông,"Thứ sáu, 16/10/2020, 06:24 (GMT+7)",https://vnexpress.net/nhom-tau-san-bay-my-tien-vao-bien-dong-4177364.html
Sai lầm khiến Mỹ mất tiêm kích tàng hình 176 triệu USD,"Thứ sáu, 16/10/2020, 01:00 (GMT+7)",https://vnexpress.net/sai-lam-khien-my-mat-tiem-kich-tang-hinh-176-trieu-usd-4172923.html
Thượng viện Mỹ muốn CEO Twitter ra điều trần,"Thứ sáu, 16/10/2020, 00:22 (GMT+7)",https://vnexpress.net/thuong-vien-my-muon-ceo-twitter-ra-dieu-tran-4177352.html
Diễn văn từng cứu mạng tổng thống Mỹ,"Thứ sáu, 16/10/2020, 00:00 (GMT+7)",https://vnexpress.net/dien-van-tung-cuu-mang-tong-thong-my-4176954.html
Vua Bỉ lần đầu gặp em gái cùng cha khác mẹ,"Thứ năm, 15/10/2020, 23:17 (GMT+7)",https://vnexpress.net/vua-bi-lan-dau-gap-em-gai-cung-cha-khac-me-4177336.html
Bay cùng chim kền kền,"Thứ năm, 15/10/2020, 22:44 (GMT+7)",https://vnexpress.net/bay-cung-chim-ken-ken-4177178.html
Thị trưởng từ chức sau khi bị nghi lộ ảnh khỏa thân,"Thứ năm, 15/10/2020, 22:04 (GMT+7)",https://vnexpress.net/thi-truong-tu-chuc-sau-khi-bi-nghi-lo-anh-khoa-than-4177154.html
Trung Quốc phản đối Mỹ bổ nhiệm điều phối viên Tây Tạng,"Thứ năm, 15/10/2020, 21:49 (GMT+7)",https://vnexpress.net/trung-quoc-phan-doi-my-bo-nhiem-dieu-phoi-vien-tay-tang-4177304.html
Bà Harris hoãn vận động tranh cử vì nhân viên mắc Covid-19,"Thứ năm, 15/10/2020, 21:26 (GMT+7)",https://vnexpress.net/ba-harris-hoan-van-dong-tranh-cu-vi-nhan-vien-mac-covid-19-4177308.html
'Phép màu' giúp cậu bé 15 tuổi sắp được phong thánh,"Thứ năm, 15/10/2020, 21:01 (GMT+7)",https://vnexpress.net/phep-mau-giup-cau-be-15-tuoi-sap-duoc-phong-thanh-4177215.html
Những thẩm phán trọn đời của Tòa án Tối cao Mỹ,"Thứ năm, 15/10/2020, 20:34 (GMT+7)",https://vnexpress.net/nhung-tham-phan-tron-doi-cua-toa-an-toi-cao-my-4177073.html
Nga rút khỏi đàm phán vụ máy bay MH17 bị bắn rơi,"Thứ năm, 15/10/2020, 20:24 (GMT+7)",https://vnexpress.net/nga-rut-khoi-dam-phan-vu-may-bay-mh17-bi-ban-roi-4177284.html
'Vũ khí Twitter' làm nên nhiệm kỳ Tổng thống Trump,"Thứ năm, 15/10/2020, 20:00 (GMT+7)",https://vnexpress.net/vu-khi-twitter-lam-nen-nhiem-ky-tong-thong-trump-4176797.html
EU trừng phạt loạt cố vấn cấp cao của Putin,"Thứ năm, 15/10/2020, 19:16 (GMT+7)",https://vnexpress.net/eu-trung-phat-loat-co-van-cap-cao-cua-putin-4177271.html
Quan chức Nhà Trắng ủng hộ kiến nghị miễn dịch cộng đồng,"Thứ năm, 15/10/2020, 18:44 (GMT+7)",https://vnexpress.net/quan-chuc-nha-trang-ung-ho-kien-nghi-mien-dich-cong-dong-4177058.html
Việt Nam bình luận việc Bộ Tứ muốn tăng hợp tác với ASEAN,"Thứ năm, 15/10/2020, 17:57 (GMT+7)",https://vnexpress.net/viet-nam-binh-luan-viec-bo-tu-muon-tang-hop-tac-voi-asean-4177245.html
Việt Nam phản đối Trung Quốc đăng ký hơn 400 công ty ở Hoàng Sa,"Thứ năm, 15/10/2020, 17:41 (GMT+7)",https://vnexpress.net/viet-nam-phan-doi-trung-quoc-dang-ky-hon-400-cong-ty-o-hoang-sa-4177220.html
Di dân tràn vào nơi lính Anh bắn đạn thật,"Thứ năm, 15/10/2020, 16:39 (GMT+7)",https://vnexpress.net/di-dan-tran-vao-noi-linh-anh-ban-dan-that-4177080.html
Tân Thủ tướng Nhật chọn Việt Nam là điểm công du đầu tiên,"Thứ năm, 15/10/2020, 16:29 (GMT+7)",https://vnexpress.net/tan-thu-tuong-nhat-chon-viet-nam-la-diem-cong-du-dau-tien-4176848.html
Tổng thống Kyrgyzstan từ chức,"Thứ năm, 15/10/2020, 16:25 (GMT+7)",https://vnexpress.net/tong-thong-kyrgyzstan-tu-chuc-4177195.html
Người biểu tình vây xe chở Hoàng hậu Thái Lan,"Thứ năm, 15/10/2020, 16:18 (GMT+7)",https://vnexpress.net/nguoi-bieu-tinh-vay-xe-cho-hoang-hau-thai-lan-4177110.html
Tiểu đoàn trưởng Mỹ mất chức vì thiết giáp chìm,"Thứ năm, 15/10/2020, 16:01 (GMT+7)",https://vnexpress.net/tieu-doan-truong-my-mat-chuc-vi-thiet-giap-chim-4177090.html
Mỹ nói chương trình hạt nhân Triều Tiên đe dọa toàn cầu,"Thứ năm, 15/10/2020, 16:01 (GMT+7)",https://vnexpress.net/my-noi-chuong-trinh-hat-nhan-trieu-tien-de-doa-toan-cau-4177070.html
Tiền tranh cử của Trump bị bí mật điều tra suốt ba năm,"Thứ năm, 15/10/2020, 15:47 (GMT+7)",https://vnexpress.net/tien-tranh-cu-cua-trump-bi-bi-mat-dieu-tra-suot-ba-nam-4177087.html
Trump: Gia đình Biden coi phó tổng thống như 'tập đoàn lợi nhuận',"Thứ năm, 15/10/2020, 15:30 (GMT+7)",https://vnexpress.net/trump-gia-dinh-biden-coi-pho-tong-thong-nhu-tap-doan-loi-nhuan-4176981.html
Trung Quốc phạt hai quan chức sau cụm dịch mới,"Thứ năm, 15/10/2020, 15:11 (GMT+7)",https://vnexpress.net/trung-quoc-phat-hai-quan-chuc-sau-cum-dich-moi-4177055.html
Tìm được gia đình sau 11 năm bị bắt cóc nhờ Google Maps,"Thứ năm, 15/10/2020, 14:45 (GMT+7)",https://vnexpress.net/tim-duoc-gia-dinh-sau-11-nam-bi-bat-coc-nho-google-maps-4177016.html
"Chồng nhốt vợ 1,5 năm trong nhà vệ sinh","Thứ năm, 15/10/2020, 14:41 (GMT+7)",https://vnexpress.net/chong-nhot-vo-1-5-nam-trong-nha-ve-sinh-4177060.html
Đòn bẩy giới sao Mỹ mang lại cho Biden,"Thứ năm, 15/10/2020, 12:08 (GMT+7)",https://vnexpress.net/don-bay-gioi-sao-my-mang-lai-cho-biden-4176470.html
Tàu chiến Trung Quốc bám theo khu trục hạm Mỹ qua eo biển Đài Loan,"Thứ năm, 15/10/2020, 12:08 (GMT+7)",https://vnexpress.net/tau-chien-trung-quoc-bam-theo-khu-truc-ham-my-qua-eo-bien-dai-loan-4176937.html
Được giải cứu từ Trung Quốc nhờ cầu xin Thủ tướng Hun Sen,"Thứ năm, 15/10/2020, 12:00 (GMT+7)",https://vnexpress.net/duoc-giai-cuu-tu-trung-quoc-nho-cau-xin-thu-tuong-hun-sen-4176980.html
Biden gây quỹ tranh cử cao kỷ lục,"Thứ năm, 15/10/2020, 11:55 (GMT+7)",https://vnexpress.net/biden-gay-quy-tranh-cu-cao-ky-luc-4176943.html
Nga muốn điều lực lượng ngăn giao tranh Armenia - Azerbaijan,"Thứ năm, 15/10/2020, 11:33 (GMT+7)",https://vnexpress.net/nga-muon-dieu-luc-luong-ngan-giao-tranh-armenia-azerbaijan-4176952.html
Bị phạt 12.000 USD vì tổ chức tiệc 'siêu lây nhiễm',"Thứ năm, 15/10/2020, 11:13 (GMT+7)",https://vnexpress.net/bi-phat-12-000-usd-vi-to-chuc-tiec-sieu-lay-nhiem-4176909.html
Chuyến thị sát Quảng Đông đầy tham vọng của ông Tập,"Thứ năm, 15/10/2020, 11:00 (GMT+7)",https://vnexpress.net/chuyen-thi-sat-quang-dong-day-tham-vong-cua-ong-tap-4176494.html
Con đường 22 khúc cua ở công viên địa chất,"Thứ năm, 15/10/2020, 10:57 (GMT+7)",https://vnexpress.net/con-duong-22-khuc-cua-o-cong-vien-dia-chat-4176914.html
Azerbaijan tuyên bố diệt hai tên lửa S-300 Armenia,"Thứ năm, 15/10/2020, 10:51 (GMT+7)",https://vnexpress.net/azerbaijan-tuyen-bo-diet-hai-ten-lua-s-300-armenia-4176919.html
Mỹ đưa Carrie Lam vào danh sách đen trừng phạt,"Thứ năm, 15/10/2020, 10:44 (GMT+7)",https://vnexpress.net/my-dua-carrie-lam-vao-danh-sach-den-trung-phat-4176864.html
'Bầy UAV' Trung Quốc thử nghiệm tấn công tự sát,"Thứ năm, 15/10/2020, 10:41 (GMT+7)",https://vnexpress.net/bay-uav-trung-quoc-thu-nghiem-tan-cong-tu-sat-4176935.html
Thuê máy bay riêng sang Đức xin tị nạn,"Thứ năm, 15/10/2020, 10:40 (GMT+7)",https://vnexpress.net/thue-may-bay-rieng-sang-duc-xin-ti-nan-4176910.html
Trung Quốc ngăn bảo tàng Pháp mở triển lãm Thành Cát Tư Hãn,"Thứ năm, 15/10/2020, 10:25 (GMT+7)",https://vnexpress.net/trung-quoc-ngan-bao-tang-phap-mo-trien-lam-thanh-cat-tu-han-4176841.html
Mỹ muốn thuê căn cứ tàu ngầm bỏ hoang sát Nga,"Thứ năm, 15/10/2020, 10:16 (GMT+7)",https://vnexpress.net/my-muon-thue-can-cu-tau-ngam-bo-hoang-sat-nga-4176886.html
Phe Cộng hòa chống Trump 'chia năm xẻ bảy',"Thứ năm, 15/10/2020, 09:43 (GMT+7)",https://vnexpress.net/phe-cong-hoa-chong-trump-chia-nam-xe-bay-4175640.html
Nga tính chế tạo 'máy bay ngày tận thế' mới,"Thứ năm, 15/10/2020, 09:15 (GMT+7)",https://vnexpress.net/nga-tinh-che-tao-may-bay-ngay-tan-the-moi-4176825.html
Nhật hạ thủy tàu ngầm hơn 700 triệu USD,"Thứ năm, 15/10/2020, 09:00 (GMT+7)",https://vnexpress.net/nhat-ha-thuy-tau-ngam-hon-700-trieu-usd-4176817.html
Loạt trợ lý Trump hồi phục sau khi mắc Covid-19,"Thứ năm, 15/10/2020, 08:54 (GMT+7)",https://vnexpress.net/loat-tro-ly-trump-hoi-phuc-sau-khi-mac-covid-19-4176786.html
Trump nói con út Barron 'không biết mình nhiễm nCoV',"Thứ năm, 15/10/2020, 08:34 (GMT+7)",https://vnexpress.net/trump-noi-con-ut-barron-khong-biet-minh-nhiem-ncov-4176794.html
"Hơn 38,7 triệu người đã nhiễm nCoV toàn cầu","Thứ năm, 15/10/2020, 07:52 (GMT+7)",https://vnexpress.net/hon-38-7-trieu-nguoi-da-nhiem-ncov-toan-cau-4176763.html
Thái Lan cấm tụ tập để ngăn biểu tình,"Thứ năm, 15/10/2020, 07:40 (GMT+7)",https://vnexpress.net/thai-lan-cam-tu-tap-de-ngan-bieu-tinh-4176766.html
"Trump cáu vì Facebook, Twitter chặn bài chỉ trích Biden","Thứ năm, 15/10/2020, 06:58 (GMT+7)",https://vnexpress.net/trump-cau-vi-facebook-twitter-chan-bai-chi-trich-biden-4176758.html
Con út của Trump đã nhiễm Covid-19,"Thứ năm, 15/10/2020, 05:50 (GMT+7)",https://vnexpress.net/con-ut-cua-trump-da-nhiem-covid-19-4176756.html
Mẫu xe tăng 'nửa Nga nửa Mỹ' của Triều Tiên,"Thứ năm, 15/10/2020, 01:00 (GMT+7)",https://vnexpress.net/mau-xe-tang-nua-nga-nua-my-cua-trieu-tien-4175807.html
Đại cử tri - những người trực tiếp bầu tổng thống Mỹ,"Thứ năm, 15/10/2020, 00:00 (GMT+7)",https://vnexpress.net/dai-cu-tri-nhung-nguoi-truc-tiep-bau-tong-thong-my-4173129.html
