Titles,Sources
"Du lịch Phan Thiết: Tất cả kinh nghiệm, điểm đến, vui chơi hấp dẫn nhất đều ở đây",https://dulichchat.com/du-lich-phan-thiet-tat-ca-kinh-nghiem-diem-den-vui-choi-hap-dan-nhat-deu-o-day/
Du lịch Phú Quốc tháng 10 – 4N3Đ nghỉ dưỡng tuyệt vời chỉ khoảng 7 triệu/người,https://dulichchat.com/du-lich-phu-quoc-thang-10-4n3d-nghi-duong-tuyet-voi-chi-khoang-7-trieu-nguoi/
Review du lịch Quy Nhơn – Phú Yên 4N3Đ tận hưởng mùa hè rực rỡ,https://dulichchat.com/review-du-lich-quy-nhon-phu-yen-4n3d-tan-huong-mua-he-ruc-ro/
Du lịch Sapa tháng 11 tất tần tật – Có hẹn với Sapa mùa hoa đẹp nhất,https://dulichchat.com/du-lich-sapa-thang-11-tat-tan-tat-co-hen-voi-sapa-mua-hoa-dep-nhat/
Kinh nghiệm du lịch Phú Quốc tháng 11 3N2Đ tận hưởng tuyệt vời,https://dulichchat.com/kinh-nghiem-du-lich-phu-quoc-thang-11-3n2d-tan-huong-tuyet-voi/
Du lịch Phú Quốc tháng 10 check in Premier Village Phú Quốc Resort siêu đẹp,https://dulichchat.com/du-lich-phu-quoc-thang-10-check-in-premier-village-phu-quoc-resort-sieu-dep/
Review du lịch Phú Quốc 3N2Đ nhóm 4 người tận hưởng tháng 9 tuyệt vời,https://dulichchat.com/review-du-lich-phu-quoc-3n2d-nhom-4-nguoi-tan-huong-thang-9-tuyet-voi/
Review du lịch Vũng Tàu – Sài Gòn – Phú Quốc 4N3Đ tận hưởng đảo ngọc,https://dulichchat.com/review-du-lich-vung-tau-sai-gon-phu-quoc-4n3d-tan-huong-dao-ngoc/
Du lịch Phú Quốc mùa cuối năm tận hưởng mùa đẹp nhất,https://dulichchat.com/du-lich-phu-quoc-mua-cuoi-nam-tan-huong-mua-dep-nhat/
Review du lịch Mai Châu tự túc 3 ngày 2 đêm cực chi tiết,https://dulichchat.com/review-du-lich-mai-chau-tu-tuc-3-ngay-2-dem-cuc-chi-tiet/
Những loại thuốc bạn nhất định phải đem theo khi đi du lịch,https://dulichchat.com/nhung-loai-thuoc-ban-nhat-dinh-phai-dem-theo-khi-di-du-lich/
Thung Nai – Đảo thiên đường đừng bỏ lỡ,https://dulichchat.com/thung-nai-dao-thien-duong-dung-bo-lo/
Review Six Senses Ninh Vân Bay Resort – Khu nghỉ dưỡng hòa mình vào thiên nhiên Nha Trang,https://dulichchat.com/review-six-senses-ninh-van-bay-resort-khu-nghi-duong-hoa-minh-vao-thien-nhien-nha-trang/
"Kinh nghiệm du lịch Huế rời xa áp lực, tìm lại chính mình",https://dulichchat.com/kinh-nghiem-du-lich-hue-roi-xa-ap-luc-tim-lai-chinh-minh/
Chuyến du lịch cuộc đời | 21 tuổi – 1 mình – 1 Đà Lạt – 27 ngày – 3 triệu,https://dulichchat.com/chuyen-du-lich-cuoc-doi-21-tuoi-1-minh-1-da-lat-27-ngay-3-trieu/
LEGACY YÊN TỬ – chốn dừng chân của những lãng khách mộng mơ,https://dulichchat.com/legacy-yen-tu-chon-dung-chan-cua-nhung-lang-khach-mong-mo/
"Review du lịch Mũi Né, Phan Thiết check in toàn những địa điểm HOT",https://dulichchat.com/review-du-lich-mui-ne-phan-thiet-check-in-toan-nhung-dia-diem-hot/
Review du lịch Phú Quốc – Hòn đảo ngọc của Việt Nam,https://dulichchat.com/review-du-lich-phu-quoc-hon-dao-ngoc-cua-viet-nam/
Bộ ảnh cực đẹp du lịch Lệ Giang – Côn Minh – Shangrila tháng 3 siêu đẹp,https://dulichchat.com/bo-anh-cuc-dep-du-lich-le-giang-con-minh-shangrila-thang-3-sieu-dep/
Du lịch Hà Nội – Ninh Bình 4N3Đ từ Sài Gòn cực chi tiết,https://dulichchat.com/du-lich-ha-noi-ninh-binh-4n3d-tu-sai-gon-cuc-chi-tiet/
