Titles,Sources
Cả Đà Lạt bỗng chốc thu nhỏ lại chỉ vừa bằng… 30 món ăn (Phần 1),https://blog.traveloka.com/vn/top-30-mon-an-da-lat-phai-thuong-thuc-ngay-khi-vua-dat-chan-toi-phan-1/
5 địa điểm check-in Đà Lạt mới toanh 2021,https://blog.traveloka.com/vn/dia-diem-du-lich-da-lat-moi/
Những cung đường ngắm mai anh đào Đà Lạt nở rộ,https://blog.traveloka.com/vn/du-lich-da-lat-thang-1-ngam-mai-anh-dao/
"@HomeXperience tận nhà, vui chơi thiệt đã!",https://blog.traveloka.com/vn/du-lich-trai-nghiem-tai-nha/
“Du lịch đúng cách”- giải pháp giúp bảo vệ những chú voi cuối cùng trên trái đất,https://blog.traveloka.com/vn/du-lich-dung-cach-giam-cau-nga-voi/
Mách bạn những ưu đãi du lịch hè 2020 hot nhất trên Traveloka Xperience,https://blog.traveloka.com/vn/uu-dai-du-lich-he-hot-2020/
Casa Marina Resort Quy Nhơn đẹp quyến rũ bên bãi biển xanh lãng mạn,https://blog.traveloka.com/vn/casa-marina-resort-quy-nhon/
Kinh nghiệm du lịch Huế 1 ngày đầy đủ lịch trình ăn – check-in – ở,https://blog.traveloka.com/vn/kinh-nghiem-du-lich-hue-1-ngay-day-du/
Tổng hợp các dịch vụ xe đưa đón sân bay Denpasar về trung tâm Bali thuận tiện nhất,https://blog.traveloka.com/vn/xe-dua-don-san-bay-denpasar-vao-trung-tam-bali/
